{
  "$schema": "rusty.hostess.project_runner.media_receipt_binding.v1",
  "profile_id": "media.receiver-first.video",
  "profile_sha256": "3d089e03150a6058c703f938ed126ce585bbcb706806946b0a5396fe5c35965f",
  "project_id": "hostess-network-workflow",
  "project_revision": 1,
  "project_spec_sha256": "6aacae990b037e0579e4d40addd12f09bb28b1436bdcd95646e50a11274cdc01",
  "product_id": "broker.media-session.standalone",
  "product_lock_id": "lock.broker.media-session.standalone",
  "product_lock_revision": 1,
  "product_lock_fingerprint": "fnv1a64-006d1c87d57a0438",
  "product_lock_sha256": "d99c51fa2b5f4a7dfa8a66268f9ca1d98c87bff307dff35a81d491c7e5943657",
  "authority_revision": 2,
  "issued_at_utc": "2026-07-11T11:55:00Z",
  "expires_at_utc": "2026-07-11T12:10:00Z",
  "observations": {
    "runtime_host_applied": true,
    "product_lock_matched": true,
    "session_ready": true
  },
  "owner_receipt_ref": {
    "path": "owner-receipts/media-adapter-receipt.json",
    "sha256": "ec12fa187002b1ea41808dd380e0ac5315f2a7251b164d7d8349cddbe233d1b4",
    "schema": "rusty.manifold.broker.adapter_receipt.v1",
    "owner": "rusty.manifold"
  }
}
